"User_Message","Response","Response_Time","Temperature"
"¿Cuán efectiva es la PrEP en la prevención del VIH y cuáles son los posibles efectos secundarios que debería tener en cuenta?","La PrEP es muy efectiva. Cuando se toma diariamente, reduce las posibilidades de contraer VIH hasta en un 99%.

Los efectos secundarios más comunes de la PrEP incluyen:

- Dolores de cabeza
- Náuseas
- Mareos
- Diarrea
- Dolor abdominal

Estos efectos suelen desaparecer en unas pocas semanas. Si experimentas cambios de ánimo o dolor severo, habla con tu doctor.","0.0","0.55"
"Me gustaría entender mejor cómo puedo acceder a la PrEP aquí en Argentina y si existen requisitos específicos que deba cumplir.","Lo siento, pero no tengo información específica sobre el acceso a la PrEP en Argentina. Te recomiendo que hables con un médico local o busques centros de salud en tu área. Ellos pueden darte detalles sobre cómo acceder a la PrEP y los requisitos necesarios.","0.0","0.79"
"¿Existen programas o campañas de información sobre la PrEP en Argentina que ayuden a difundir su acceso y beneficios?","Lo siento, no tengo información específica sobre programas o campañas en Argentina. Te sugiero que contactes a organizaciones locales de salud. Ellos pueden ofrecerte detalles sobre la PrEP, su acceso y beneficios.","0.0","1.1"
"¿Hay recursos o grupos de apoyo donde pueda conectarme con otras personas que estén usando PrEP y compartir experiencias?","Lo siento, no tengo información específica sobre grupos de apoyo en Argentina. Te sugiero que busques organizaciones locales de salud. Ellos pueden ayudarte a encontrar recursos y grupos donde puedas conectarte con otras personas que usan PrEP.","0.0","1.14"
"¿Existen diferencias en la efectividad de la PrEP según el grupo de población o tipo de relación sexual que tenga?","Sí, la efectividad de la PrEP puede variar según el tipo de relación sexual. 

Para mujeres que tienen sexo vaginal, PrEP es más efectiva después de tomarla diariamente durante aproximadamente 21 días. Para sexo anal receptivo, es efectiva en unos 7 días de uso diario. 

Es importante hablar con un médico sobre tu situación específica. Ellos pueden ofrecerte más información adaptada a tus necesidades.","0.0","0.98"
"¿Dónde puedo encontrar más información sobre investigaciones recientes o estudios clínicos en torno a la PrEP en mujeres jóvenes como yo?","Lo siento, no tengo información específica sobre investigaciones recientes en torno a la PrEP. Te recomiendo que busques en sitios web de salud confiables, como el CDC. También puedes consultar a médicos o clínicas locales. Ellos pueden ofrecerte información actualizada sobre estudios y recursos sobre la PrEP para mujeres jóvenes.","0.0","1.2"
"¿Hay diferencias en la disponibilidad de PrEP según la región de Argentina, o es accesible de manera uniforme en todo el país?","Lo siento, no tengo información específica sobre la disponibilidad de PrEP en Argentina. Te recomiendo que contactes a organizaciones locales de salud. Ellos pueden ofrecerte detalles sobre el acceso a PrEP en diferentes regiones y la disponibilidad en tu área.","0.0","1.06"
"¿Existen recomendaciones específicas para el seguimiento médico que deba tener en cuenta mientras uso PrEP, como análisis de sangre o chequeos regulares?","Sí, hay recomendaciones para el seguimiento médico mientras usas PrEP. Es importante hacer lo siguiente:

1. **Exámenes de sangre cada 3 meses.** Esto incluye pruebas de VIH y función renal.
2. **Consulta médica regular.** Habla con tu doctor sobre tu uso de PrEP y cualquier preocupación.
3. **Pruebas de otras infecciones.** Considera hacer pruebas para otras infecciones de transmisión sexual si es necesario.

Habla con tu médico para asegurarte de seguir todas las pautas adecuadas.","0.0","0.85"
"¿Hay algún efecto a largo plazo que deba considerar al usar PrEP, especialmente en relación con la salud ósea o renal?","La PrEP es generalmente segura, pero es importante hacer seguimiento con tu médico. 

En algunos casos, el uso a largo plazo de PrEP puede afectar la salud renal. Por eso, se recomienda hacer análisis de función renal cada tres meses. 

Sobre la salud ósea, no hay evidencia clara de efectos negativos. Sin embargo, siempre es bueno hablar con tu médico sobre cualquier preocupación específica.

Recuerda que tu médico puede ofrecerte la información más precisa y adaptada a tus necesidades.","0.0","0.89"
"¿Hay algún tipo de mito o desinformación común sobre la PrEP que deba tener en cuenta al hablar con otras personas sobre su uso?","Sí, hay algunos mitos comunes sobre la PrEP. Aquí te menciono algunos:

1. **La PrEP es solo para hombres.** Esto es falso. La PrEP es efectiva para todas las personas, incluidas las mujeres.

2. **La PrEP no es segura.** La PrEP es segura y ha sido aprobada por autoridades de salud.

3. **No necesito usar otros métodos de prevención.** Aunque la PrEP es muy efectiva, no protege contra otras infecciones de transmisión sexual. Usar condones también es importante.

4. **La PrEP es una cura para el VIH.** No es una cura. Es un método para prevenir la infección.

5. **No es necesario hacerse pruebas regulares.** Es importante hacerse pruebas de VIH y otras infecciones regularmente mientras usas PrEP.

Hablar sobre estos mitos puede ayudar a informar a otros sobre la PrEP. Si tienes más preguntas, no dudes en preguntar.","0.0","1.05"
"¿Qué tipo de información adicional debería buscar sobre la PrEP para sentirme más segura en mi decisión de usarla?","Para sentirte más segura en tu decisión de usar PrEP, considera buscar información sobre:

1. **Efectividad de PrEP.** Cómo reduce el riesgo de VIH en diferentes situaciones.
2. **Efectos secundarios.** Qué esperar y cómo manejarlos.
3. **Acceso a PrEP.** Dónde y cómo obtenerla en tu área.
4. **Seguimiento médico.** Importancia de pruebas regulares y consultas.
5. **Testimonios de otros.** Experiencias de personas que usan PrEP.

Hablar con un médico o un consejero sobre tus dudas también puede ser útil. Si necesitas más información, pregúntame.","0.0","1.04"
"¿Hay estudios o estadísticas específicas que muestren la efectividad de la PrEP en mujeres jóvenes en comparación con otros grupos?","No tengo estudios específicos sobre la efectividad de la PrEP en mujeres jóvenes en comparación con otros grupos. Sin embargo, la PrEP es efectiva para todas las personas que están en riesgo de VIH. Generalmente, cuando se toma diariamente, la efectividad es de hasta el 99%.

Te animo a que busques en sitios de salud confiables, como el CDC. También podrías hablar con profesionales de la salud para obtener información más detallada y específica. Si tienes más preguntas, no dudes en preguntar.","0.0","1.1"
"¿Existen iniciativas o programas educativos en Argentina que se enfoquen en la PrEP y la salud sexual para mujeres jóvenes?","Lo siento, no tengo información específica sobre iniciativas o programas educativos sobre la PrEP en Argentina. Te recomiendo que contactes a organizaciones locales de salud. Ellos pueden ofrecerte detalles sobre programas que se enfoquen en la PrEP y la salud sexual para mujeres jóvenes en tu área.","0.0","0.57"
"¿Podrías darme más información sobre cómo se lleva a cabo el proceso de consulta médica para iniciar la PrEP? ¿Qué tipo de preguntas o evaluaciones suelen hacerse?","Para iniciar la PrEP, el proceso de consulta médica incluye varias etapas. Aquí te explico:

1. **Evaluación inicial.** El médico te hará preguntas sobre tu salud sexual y antecedentes médicos.

2. **Pruebas de VIH.** Necesitarás una prueba de VIH para confirmar que no estás infectada.

3. **Pruebas de salud.** También se pueden hacer pruebas de función renal y otras infecciones de transmisión sexual.

4. **Discusión sobre riesgos.** Hablarás sobre tu riesgo de contraer VIH y otras opciones de prevención.

5. **Receta de PrEP.** Si todo está bien, el médico te dará una receta para PrEP.

6. **Seguimiento regular.** Deberás regresar cada 3 meses para chequeos y pruebas.

Es importante ser honesta y abierta durante la consulta. Esto ayudará a tu médico a brindarte el mejor cuidado. Si tienes más dudas, ¡pregunta!","0.0","0.51"
"¿Hay algún tipo de asesoramiento o recursos disponibles en Argentina para ayudarme a manejar la adherencia a la PrEP y asegurarme de tomarla de manera regular?","Lo siento, no tengo información específica sobre recursos o asesoramiento en Argentina para manejar la adherencia a la PrEP. Te sugiero que contactes a organizaciones locales de salud. Ellos pueden ofrecerte apoyo y recursos para ayudarte a seguir tomando PrEP de manera regular.","0.0","0.71"
"¿Existen aplicaciones o herramientas digitales que puedan ayudarme a recordar tomar la PrEP y hacer seguimiento de mis consultas médicas?","Lo siento, no tengo información específica sobre aplicaciones o herramientas digitales para el seguimiento de la PrEP. Te sugiero que busques en tiendas de aplicaciones o hables con organizaciones locales de salud. Ellos pueden ofrecerte recomendaciones sobre recursos que te ayuden a recordar tomar la PrEP y hacer seguimiento de tus consultas médicas.","0.0","0.59"
"¿Hay algún tipo de capacitación o formación que pueda recibir en Argentina sobre el uso de la PrEP y la salud sexual en general?","Lo siento, no tengo información específica sobre capacitación o formación en Argentina sobre el uso de la PrEP y la salud sexual. Te recomiendo que contactes a organizaciones locales de salud. Ellos pueden ofrecerte detalles sobre programas educativos y recursos disponibles en tu área.","0.0","0.59"
"¿Hay grupos de profesionales de la salud en Argentina que se especialicen en la PrEP y la salud sexual, a los que podría acudir para obtener información más detallada y apoyo?","Lo siento, no tengo información específica sobre grupos de profesionales de la salud en Argentina que se especialicen en la PrEP y la salud sexual. Te sugiero que contactes a organizaciones locales de salud o clínicas especializadas. Ellos pueden ofrecerte información detallada y apoyo sobre la PrEP y la salud sexual.","0.0","0.92"
"¿Hay literatura o guías prácticas en español sobre el uso de la PrEP que pueda consultar para ampliar mi conocimiento sobre su uso y manejo?","Lo siento, no tengo información específica sobre literatura o guías prácticas en español sobre la PrEP. Te recomiendo que busques en sitios web de salud confiables, como el CDC o la Organización Mundial de la Salud. También puedes preguntar a profesionales de la salud en tu área. Ellos pueden ofrecerte materiales y recursos útiles sobre la PrEP.","0.0","1.05"
"¿Hay algún tipo de certificación o reconocimiento que deba buscar en los profesionales de la salud que me asesoren sobre la PrEP para asegurarme de que son confiables?","Lo siento, no tengo información específica sobre certificaciones o reconocimientos para profesionales de la salud en Argentina. Te sugiero que busques médicos o clínicas que tengan experiencia en salud sexual y PrEP. 

Asegúrate de que sean profesionales licenciados y que trabajen en organizaciones de salud reconocidas. Puedes consultar reseñas o pedir recomendaciones a personas de confianza.","0.0","1.11"
"¿Existen foros o plataformas en línea donde pueda conectarme con otras mujeres jóvenes que estén considerando o ya estén usando PrEP, para compartir experiencias y consejos?","Lo siento, no tengo información específica sobre foros o plataformas en línea para mujeres jóvenes sobre la PrEP. Te sugiero buscar en redes sociales o en grupos de salud en línea. También puedes contactar organizaciones locales de salud para más información sobre recursos y grupos de apoyo.","0.0","0.51"
"¿Hay alguna diferencia en la disponibilidad de PrEP en diferentes provincias de Argentina, o es accesible en todo el país?","Lo siento, no tengo información específica sobre la disponibilidad de PrEP en diferentes provincias de Argentina. Te recomiendo que contactes a organizaciones locales de salud. Ellos pueden ofrecerte detalles sobre el acceso a PrEP en diferentes regiones y la disponibilidad en tu área.","0.0","0.83"
"¿Podrías contarme si hay algún tipo de costos asociados a la obtención de PrEP en Argentina, ya sea a través del sistema de salud público o privado?","Lo siento, no tengo información específica sobre los costos de obtener PrEP en Argentina. Te recomiendo que hables con un médico local o contactes a organizaciones de salud. Ellos pueden ofrecerte detalles sobre los costos y cómo acceder a PrEP a través del sistema de salud público o privado.","0.0","0.72"
"¿Existen campañas de concientización en Argentina sobre la PrEP que puedan informarme más sobre su uso y beneficios?","Lo siento, no tengo información específica sobre campañas de concientización en Argentina sobre la PrEP. Te sugiero que contactes a organizaciones locales de salud. Ellos pueden ofrecerte detalles sobre el uso y beneficios de la PrEP en tu área.","0.0","0.54"
"¿Hay algún tipo de evaluación o chequeo médico que deba realizarme antes de comenzar a usar la PrEP, y con qué frecuencia debería hacerlo una vez que comience el tratamiento?","Antes de comenzar a usar la PrEP, debes realizar algunas evaluaciones. Aquí te las detallo:

1. **Prueba de VIH.** Es esencial confirmar que no estés infectada con el virus.

2. **Pruebas de salud.** Esto incluye análisis de función renal y pruebas para otras infecciones de transmisión sexual si es necesario.

3. **Evaluación de salud sexual.** Tu médico te hará preguntas sobre tu salud sexual y riesgos.

Una vez que comiences el tratamiento, deberías realizar un seguimiento con chequeos cada 3 meses. Esto incluirá pruebas de VIH y función renal.

Es importante hablar con tu médico sobre cualquier inquietud. Si tienes más preguntas, ¡no dudes en preguntar!","0.0","0.8"
