"User_Message","Response","Response_Time","Temperature"
"¿La PrEP afecta mis hormonas?","La PrEP (prophylaxie pré-exposition) ne devrait pas avoir d'impact direct sur vos hormones. Cependant, il est important de discuter de toutes les préoccupations relatives à la santé avec votre médecin, y compris les interactions possibles avec d'autres médicaments hormonaux que vous pourriez prendre.

Si vous êtes sous traitement hormonal, assurez-vous d'informer votre professionnel de la santé afin qu'il puisse évaluer toute interaction potentielle et vous donner des conseils appropriés. Si vous avez d'autres questions, n'hésitez pas à demander !","0.0","0.82"
"¿Las mujeres trans pueden usar PrEP de la misma manera que los hombres cis?","Sí, las mujeres trans pueden usar PrEP de la misma manera que los hombres cis. La PrEP es efectiva en individuos que son VIH negativos y que están en riesgo de infección por el VIH. Es importante que cualquier persona interesada en la PrEP hable con un profesional de la salud para discutir sus necesidades específicas, realizar pruebas de VIH y evaluar su situación de salud en general. Si tienes más preguntas, no dudes en preguntar.","0.0","0.79"
"¿Los estrógenos hacen que la PrEP sea menos efectiva?","La PrEP no se ve afectada directamente por los estrógenos. Sin embargo, si estás tomando hormonas feminizantes, es importante discutir con tu médico sobre cualquier posible interacción. La PrEP sigue siendo efectiva para prevenir el VIH en personas que son VIH negativas, independientemente de su tratamiento hormonal. Si tienes más preguntas sobre esto, no dudes en preguntar.","0.0","0.67"
"¿Los médicos saben cómo tratar a mujeres trans con PrEP?","Sí, muchos médicos están capacitados para tratar a mujeres trans que deseen usar PrEP. Es fundamental que hables abiertamente con tu médico sobre tus necesidades y preocupaciones específicas. Ellos pueden realizar pruebas necesarias, discutir la eficacia de la PrEP y evaluar cualquier interacción potencial con los tratamientos hormonales que puedas estar utilizando. Si tienes más preguntas o necesitas ayuda para encontrar un proveedor de salud, no dudes en preguntar.","0.0","0.53"
"¿Hay estigma en la comunidad trans sobre el uso de PrEP?","El estigma sobre el uso de PrEP puede existir en algunas comunidades, incluyendo la comunidad trans. Sin embargo, es importante recordar que:

- **Educación y Concienciación**: La discusión abierta sobre PrEP y su efectividad puede ayudar a reducir el estigma. Cuanto más se sepa, menos temores o malentendidos habrá.

- **Normalización**: Cada vez más personas están utilizando PrEP como una opción de prevención responsable, lo que ayuda a normalizar su uso.

- **Apoyo Comunitario**: Buscar grupos de apoyo donde se hable sobre PrEP puede proporcionar un espacio seguro para compartir experiencias y reducir el estigma.

Si tienes más preguntas o necesitas recursos para afrontar este tema, no dudes","0.0","1.06"
"User: ¿Cómo puedo encontrar un médico que sea sensible y conocedor de las necesidades de las mujeres trans en relación con la PrEP?","Para encontrar un médico que sea sensible y conocedor de las necesidades de las mujeres trans en relación con la PrEP, considera los siguientes pasos:

- **Investiga Clínicas Especializadas**: Busca clínicas que se especialicen en salud LGBTQ+ o en atención a personas trans. Estas clínicas a menudo tienen personal capacitado en temas específicos.

- **Consulta Redes Comunitarias**: Conéctate con organizaciones locales que apoyan a la comunidad trans. Ellas pueden recomendar médicos y clínicas.

- **Revisar Reseñas en Línea**: Utiliza plataformas de salud donde los pacientes dejan reseñas sobre su experiencia con médicos, buscando comentarios sobre la atención a pacientes trans.

- **Pregunta a Otros**: Si tienes amigos o conocidos en","0.0","0.83"
"la comunidad trans, pregúntales sobre sus experiencias y recomendaciones de médicos.

- **Línea Directa de Recursos**: Algunas organizaciones tienen líneas directas que pueden ayudarte a encontrar proveedores de salud inclusivos y competentes.

¿Hay algún recurso específico que te gustaría explorar más a fondo?","Para encontrar un médico sensible a las necesidades de las mujeres trans en relación con la PrEP, considera estos pasos:

- **Investiga Clínicas Especializadas**: Busca clínicas enfocadas en salud LGBTQ+.
  
- **Consulta Redes Comunitarias**: Conéctate con organizaciones locales.
  
- **Revisar Reseñas en Línea**: Usa plataformas de salud para leer experiencias de otros.
  
- **Pregunta a Otros**: Habla con amigos trans sobre sus recomendaciones.
  
- **Línea Directa de Recursos**: Busca organizaciones que ofrezcan asistencia para encontrar proveedores inclusivos.

Si deseas más información sobre algún recurso específico, no dudes en preguntar.","0.0","0.66"
"¿Qué consideraciones debo tener en cuenta al iniciar PrEP mientras estoy en tratamiento hormonal?","Al iniciar PrEP mientras estás en tratamiento hormonal, considera lo siguiente:

- **Consulta Médica**: Habla con tu médico sobre tus tratamientos hormonales y cómo podrían interactuar con PrEP.

- **Monitoreo de Salud**: Realiza pruebas regulares para asegurarte de que ambos tratamientos no afecten negativamente tu salud.

- **Efectos Secundarios**: Informa a tu médico sobre cualquier cambio en tu estado de salud o efectos secundarios que experimentes.

- **Adherencia**: Asegúrate de que puedes mantener una rutina de toma de PrEP mientras sigues tu tratamiento hormonal.

Si tienes más preguntas o necesitas aclaraciones, no dudes en preguntar.","0.0","1.02"
"¿Hay efectos secundarios específicos de la PrEP que deba tener en cuenta mientras estoy en tratamiento hormonal?","Al iniciar PrEP mientras estás en tratamiento hormonal, es importante considerar los siguientes efectos secundarios y precauciones:

- **Efectos Secundarios Comunes**: Pueden incluir náuseas, dolores de cabeza, y fatiga. Estos suelen ser temporales y pueden disminuir con el tiempo.

- **Monitoreo de la Salud**: Realiza pruebas regulares para evaluar la función renal, ya que PrEP puede tener un impacto en los riñones.

- **Interacciones Medicamentosas**: Discute con tu médico cualquier posible interacción entre los medicamentos hormonales y PrEP.

- **Efectos en la Salud Mental**: Mantén comunicación abierta sobre cambios en tu estado emocional, ya que la adherencia a","0.0","1.05"
"la PrEP y al tratamiento hormonal puede verse afectada por factores emocionales.

- **Efectos sobre la Libido**: Algunas personas pueden experimentar cambios en la libido, lo cual es importante discutir con tu médico.

¿Hay algo más específico que te gustaría saber sobre los efectos secundarios de la PrEP en tu situación particular?","Claro, aquí tienes información adicional sobre las consideraciones al iniciar PrEP mientras estás en tratamiento hormonal:

- **Consulta Médica**: Es fundamental discutir tus tratamientos hormonales y cómo podrían interactuar con PrEP.

- **Monitoreo de Salud**: Haz pruebas regulares para asegurarte de que ambos tratamientos no impacten negativamente tu salud.

- **Efectos Secundarios**: Informa a tu médico sobre cualquier cambio en tu salud o efectos secundarios que experimentes.

- **Adherencia**: Asegúrate de que puedes mantener una rutina de toma de PrEP mientras sigues tu tratamiento hormonal.

Si tienes más preguntas o inquietudes, ¡no dudes en preguntar!","0.0","0.85"
"¿Existen estudios específicos que analicen la eficacia de la PrEP en mujeres trans que están en tratamiento hormonal?","Sí, hay estudios que investigan la eficacia de la PrEP en mujeres trans que están en tratamiento hormonal. Estos estudios han mostrado que la PrEP es efectiva en la prevención del VIH en esta población, siempre y cuando se use de manera consistente. Es importante que las mujeres trans discutan con sus proveedores de salud sobre cualquier posible interacción entre la PrEP y sus tratamientos hormonales, así como sobre el seguimiento médico necesario.

Si deseas más detalles sobre estos estudios o recomendaciones específicas, no dudes en preguntar.","0.0","0.58"
"¿Hay recomendaciones sobre la frecuencia con la que debo hacerme pruebas de VIH y otras infecciones de transmisión sexual mientras uso PrEP y estoy en tratamiento hormonal?","Mientras uses PrEP y estés en tratamiento hormonal, es recomendable seguir estas pautas sobre pruebas:

- **Pruebas de VIH**: Realiza una prueba de VIH antes de comenzar la PrEP y cada tres meses durante su uso.
  
- **Pruebas de infecciones de transmisión sexual (ITS)**: Se recomienda hacerse pruebas para gonorrea, clamidia y sífilis cada tres a seis meses, dependiendo de tus comportamientos de riesgo y actividades sexuales.

- **Monitoreo de salud**: Asegúrate de que tu médico evalúe la función renal cada tres meses, ya que la PrEP puede afectar los riñones.

Es fundamental mantener una comunicación abierta con tu proveedor de salud sobre tus necesidades y cualquier","0.0","0.79"
"preocupación que puedas tener. 

¿Hay algún aspecto específico de las pruebas o del monitoreo que te gustaría discutir más a fondo?","Claro, aquí tienes información sobre las pruebas y monitoreo necesarios mientras usas PrEP:

- **Pruebas de VIH**: Realiza una prueba antes de iniciar PrEP y cada tres meses durante su uso para asegurarte de que no has contraído el virus.

- **Pruebas de ITS**: Se recomienda hacerse pruebas para gonorrea, clamidia y sífilis cada tres a seis meses, dependiendo de tus prácticas sexuales y riesgos.

- **Monitoreo de función renal**: Es fundamental que tu médico evalúe tu función renal cada tres meses, ya que PrEP puede tener efectos en los riñones.

Si tienes preguntas sobre un aspecto específico o necesitas más información, ¡no dudes en preguntar!","0.0","0.56"
"¿Existen recursos o grupos de apoyo donde pueda hablar sobre mi experiencia con PrEP y tratamiento hormonal?","Claro, aquí tienes algunas maneras de encontrar recursos y grupos de apoyo para hablar sobre tu experiencia con PrEP y tratamiento hormonal:

- **Organizaciones de Salud**: Busca organizaciones locales o nacionales que apoyen a la comunidad LGBTQ+ y que ofrezcan grupos de apoyo para personas trans.
  
- **Foros en Línea**: Plataformas como Reddit tienen comunidades donde los usuarios comparten experiencias sobre PrEP y tratamientos hormonales.

- **Redes Sociales**: Únete a grupos en Facebook o Instagram centrados en salud trans y VIH.

- **Clínicas de Salud**: Algunas clínicas ofrecen grupos de apoyo y recursos educativos sobre PrEP y tratamientos hormonales.

Si necesitas ayuda para encontrar un grupo específico, no dudes en preguntar.","0.0","0.83"
"¿Hay recursos específicos que recomiendes para encontrar información sobre la interacción entre la PrEP y el tratamiento hormonal?","Claro, aquí tienes algunos recursos que pueden ayudarte a encontrar información sobre la interacción entre la PrEP y el tratamiento hormonal:

- **Organizaciones de Salud LGBTQ+**: Consulta organizaciones como la *Human Rights Campaign* o *GLMA*, que ofrecen información sobre salud para la comunidad trans.

- **Clínicas Especializadas**: Busca clínicas que se especialicen en salud trans y VIH. Ellas suelen tener personal capacitado para abordar estas interacciones.

- **Foros en Línea**: Plataformas como Reddit o grupos en Facebook pueden ofrecer experiencias de otros usuarios sobre el tema.

- **Literatura Científica**: Busca artículos académicos o revisiones sobre la PrEP y el tratamiento hormonal en bases de datos como PubMed.

Si","0.0","0.85"
"tienes alguna pregunta específica sobre estos recursos o necesitas recomendaciones adicionales, ¡hazmelo saber!","Claro, aquí tienes algunos recursos que pueden ayudarte a encontrar información sobre la interacción entre la PrEP y el tratamiento hormonal:

- **Organizaciones de Salud LGBTQ+**: Consulta organizaciones como la *Human Rights Campaign* o *GLMA*, que ofrecen información sobre salud para la comunidad trans.
  
- **Clínicas Especializadas**: Busca clínicas que se especialicen en salud trans y VIH; suelen tener personal capacitado para abordar estas interacciones.

- **Foros en Línea**: Plataformas como Reddit o grupos en Facebook pueden ofrecer experiencias de otros usuarios sobre el tema.

- **Literatura Científica**: Revisa artículos académicos en bases de datos como PubMed sobre la PrEP y el tratamiento hormonal.

Si deseas más detalles","0.0","1.2"
"o tienes alguna pregunta específica sobre estos recursos, ¡hazmelo saber!","Claro, aquí tienes algunos recursos que pueden ayudarte a encontrar información sobre la interacción entre la PrEP y el tratamiento hormonal:

- **Organizaciones de Salud LGBTQ+**: Consulta organizaciones como la *Human Rights Campaign* o *GLMA*, que ofrecen información sobre salud para la comunidad trans.
  
- **Clínicas Especializadas**: Busca clínicas que se especialicen en salud trans y VIH; suelen tener personal capacitado para abordar estas interacciones.

- **Foros en Línea**: Plataformas como Reddit o grupos en Facebook pueden ofrecer experiencias de otros usuarios sobre el tema.

- **Literatura Científica**: Revisa artículos académicos en bases de datos como PubMed sobre la PrEP y el tratamiento hormonal.

Si deseas más detalles","0.0","0.61"
"¿Existen recomendaciones específicas sobre qué buscar en un médico que trate a mujeres trans que usan PrEP y tratamiento hormonal?","Al buscar un médico que trate a mujeres trans usando PrEP y tratamiento hormonal, considera lo siguiente:

- **Experiencia en Salud Trans**: Busca médicos con experiencia en salud trans y conocimientos sobre PrEP.
  
- **Sensibilidad Cultural**: Asegúrate de que el médico sea inclusivo y comprenda las preocupaciones específicas de la comunidad trans.

- **Recomendaciones**: Pregunta a organizaciones de salud LGBTQ+ o grupos de apoyo sobre médicos recomendados en tu área.

- **Disponibilidad de Recursos**: Verifica si el médico ofrece recursos sobre PrEP y tratamiento hormonal.

Si necesitas más ayuda para encontrar un médico adecuado, no dudes en preguntar.","0.0","0.92"
"¿Hay algún tipo de examen o análisis adicional que deba considerar al estar en tratamiento hormonal y usar PrEP?","Al estar en tratamiento hormonal y usar PrEP, considera los siguientes exámenes adicionales:

- **Monitoreo de Hormonas**: Revisa regularmente los niveles hormonales para asegurar que el tratamiento esté funcionando correctamente.
  
- **Función Hepática**: Realiza pruebas para evaluar la función del hígado, especialmente si estás tomando hormonas junto con PrEP.

- **Evaluación de Salud Mental**: Considera un seguimiento de tu salud mental, ya que los cambios hormonales pueden influir en tu bienestar emocional.

Es importante discutir estos exámenes con tu médico para personalizar tu seguimiento. Si tienes más preguntas, ¡no dudes en preguntar!","0.0","1.05"
"¿Hay algún síntoma o efecto secundario específico que deba observar mientras uso PrEP y estoy en tratamiento hormonal que me indique que podría haber un problema?","Al usar PrEP mientras estás en tratamiento hormonal, observa los siguientes síntomas o efectos secundarios que podrían indicar un problema:

- **Cambios en la función renal**: Signos como disminución de la producción de orina, hinchazón en las piernas o tobillos.

- **Problemas gastrointestinales**: Náuseas persistentes, diarrea o dolor abdominal severo.

- **Cambios en el estado de ánimo**: Depresión, ansiedad o cambios significativos en el comportamiento.

- **Reacciones alérgicas**: Erupciones cutáneas, picazón o dificultad para respirar.

Es crucial comunicar cualquier síntoma inusual a tu médico para una evaluación adecuada. Mantén un seguimiento regular y no dudes en preguntar","0.0","0.98"
"sobre cualquier preocupación que tengas.

¿Hay algún síntoma particular que te gustaría saber más a fondo o alguna preocupación específica que te gustaría discutir?","Claro, aquí tienes información sobre los síntomas a observar mientras usas PrEP y estás en tratamiento hormonal:

- **Cambios en la función renal**: Disminución de la producción de orina, hinchazón en piernas o tobillos.
  
- **Problemas gastrointestinales**: Náuseas persistentes, diarrea o dolor abdominal severo.

- **Cambios en el estado de ánimo**: Depresión o ansiedad significativas.

- **Reacciones alérgicas**: Erupciones cutáneas, picazón, o dificultad para respirar.

Es fundamental comunicar cualquier síntoma inusual a tu médico. Si tienes preocupaciones específicas, ¡házmelo saber!","0.0","0.93"
"¿Existen diferencias en la manera en que se prescribe PrEP a mujeres trans en comparación con hombres cis?","Sí, existen algunas diferencias en la manera en que se prescribe PrEP a mujeres trans en comparación con hombres cis. Aquí hay algunos puntos a considerar:

- **Evaluación de Riesgo**: Los proveedores de salud pueden evaluar el riesgo de VIH usando diferentes criterios según la historia de salud sexual y los factores de riesgo específicos.

- **Interacciones con Terapias Hormonales**: Las mujeres trans pueden recibir tratamientos hormonales que podrían interactuar con la PrEP, lo que requiere un enfoque más personalizado.

- **Monitoreo de Salud**: Puede ser necesario un seguimiento más cercano para evaluar cómo la PrEP y los tratamientos hormonales afectan la salud general.

Siempre es importante discutir tus necesidades específicas con un profesional de la salud. Si tienes","0.0","1.19"
"más preguntas sobre el proceso de prescripción o cualquier otro detalle que te preocupe, ¡no dudes en preguntar!","Claro, aquí tienes información sobre las diferencias en la prescripción de PrEP para mujeres trans:

- **Evaluación de Riesgo**: Los médicos evalúan el riesgo de VIH basándose en la historia sexual y factores de riesgo específicos.

- **Interacciones Hormonales**: Las mujeres trans que toman hormonas pueden necesitar un enfoque personalizado para evitar interacciones.

- **Monitoreo Adicional**: Puede ser necesario un seguimiento más frecuente para observar cómo PrEP y los tratamientos hormonales afectan la salud.

Siempre discute tus necesidades con un profesional de salud. Si tienes más preguntas, ¡estoy aquí para ayudarte!","0.0","1.17"
"¿Es necesario ajustar la dosis de PrEP para las mujeres trans que están en tratamiento hormonal?","No, no es necesario ajustar la dosis de PrEP para las mujeres trans que están en tratamiento hormonal. La PrEP se prescribe a una dosis estándar (Truvada) y es efectiva en personas VIH negativas, independientemente de su tratamiento hormonal. Sin embargo, es importante que las mujeres trans hablen con sus proveedores de salud sobre cualquier posible interacción entre sus tratamientos hormonales y la PrEP, así como la necesidad de monitoreo regular. Si tienes más preguntas, no dudes en preguntar.","0.0","0.92"
"¿Hay diferencias en los efectos secundarios de la PrEP para mujeres trans en comparación con hombres cis?","Los efectos secundarios de la PrEP son generalmente similares para todas las personas, incluyendo mujeres trans y hombres cis. Sin embargo, hay algunas consideraciones específicas para las mujeres trans:

- **Interacciones Hormonales**: Las mujeres trans que utilizan terapia hormonal deben discutir con su médico cualquier posible interacción entre la PrEP y sus hormonas, aunque no se ha demostrado que la PrEP afecte negativamente la terapia hormonal.

- **Monitoreo de Salud**: Se recomienda un seguimiento regular para evaluar la salud general, incluyendo la función renal y los efectos sobre la salud mental.

Es importante que cada persona se comunique abiertamente con su proveedor de salud para abordar cualquier preocupación específica. Si tienes más preguntas, ¡aquí estoy para ayudarte","0.0","0.54"
