"User_Message","Response","Response_Time","Temperature"
"Is PrEP really as effective as they claim, or are there cases where it fails?","PrEP is highly effective, reducing the risk of HIV by about 99% when taken consistently as prescribed. However, there are instances where it may fail, primarily due to:

- **Inconsistent Use**: Missing doses can significantly lower its effectiveness.
- **Existing HIV Infection**: Starting PrEP while already HIV-positive can lead to treatment failure.
- **Type of Exposure**: It may take time for PrEP to reach full effectiveness based on the specific sexual activity involved.

Regular follow-ups and adherence to the regimen are crucial for maximizing PrEP's protective benefits. Always consult your healthcare provider for personalized advice.","0.0","0.53"
"Are there long-term risks that doctors aren’t talking about? What about potential impacts on kidney function or bone density that could arise with prolonged use?","Concerns regarding long-term risks of PrEP, particularly on kidney function and bone density, are valid and have been studied:

- **Kidney Function**: Some users may experience mild decreases in kidney function, but serious issues are rare. Regular monitoring is recommended, typically every three months, to ensure kidney health.

- **Bone Density**: Initial studies indicated a slight decrease in bone mineral density (BMD) among some users, but these changes often stabilize over time and are usually reversible after discontinuation.

Overall, while there are potential risks, regular monitoring and consultation with healthcare providers can help manage these concerns effectively. Always discuss any worries with your provider for personalized guidance.","0.0","0.72"
"How do we know PrEP doesn’t cause hidden damage to the body over time? It seems like we’re still learning about its long-term effects, and what if unexpected issues arise years later?","Your concerns about the long-term effects of PrEP are valid. While PrEP has been shown to be safe for many users, ongoing research continues to monitor its long-term effects. Here are some key points:

- **Clinical Studies**: Long-term studies, including the iPrEx and Partners PrEP, have monitored users for several years, finding no significant long-term adverse effects.
  
- **Regular Monitoring**: Healthcare providers conduct routine testing (e.g., kidney function tests) every three months to catch any potential issues early.

- **Post-Marketing Surveillance**: Ongoing studies and reports allow researchers to identify any unexpected long-term effects as more people use PrEP.

While we can’t predict every potential issue, existing evidence supports PrEP's safety when used correctly. Always consult your healthcare provider to discuss any concerns about your health while using PrEP.","0.0","1.12"
"Is there any solid, unbiased research that actually presents negative findings about PrEP? I feel like the overwhelming focus has been on its benefits—what about the downsides?","It's important to consider both the benefits and potential downsides of PrEP. While most studies emphasize its effectiveness in preventing HIV, some research has highlighted concerns:

- **Adverse Effects**: Some users report mild side effects like nausea, headaches, or impacts on kidney function. Serious side effects are rare but can occur.
- **Adherence Challenges**: Research indicates that inconsistent use can lead to failure in preventing HIV, emphasizing the need for regular adherence.
- **Risk Compensation**: Some studies suggest that users may engage in riskier sexual behaviors, assuming they are fully protected, though many studies indicate this is not widespread.

For detailed findings, you can refer to studies like the iPrEx study and HPTN 067, which discuss both benefits and potential concerns regarding PrEP use. Always consult healthcare providers for personalized insights.","0.0","1.15"
"Are there instances where PrEP has actually failed in real-world scenarios, leading to HIV transmission? What do those cases indicate about its reliability?","Yes, there are documented instances where PrEP has failed, leading to HIV transmission. These cases typically highlight key factors:

- **Inconsistent Use**: Missing doses significantly reduces PrEP's effectiveness. Studies show that adherence is crucial for maximum protection.
  
- **Existing HIV Infection**: Some individuals may have started PrEP while already HIV-positive, which can lead to treatment failure.

- **Type of Exposure**: It may take time for PrEP to reach full effectiveness based on the specific sexual activity involved.

These cases underscore the importance of regular adherence and monitoring. PrEP is highly effective when used consistently, but it is not foolproof. Continuous engagement with healthcare providers can help manage risks and ensure optimal use.","0.0","0.73"
"Are you saying that the cases of PrEP failure are primarily attributed to user error? What evidence supports this claim, and how does it address concerns about the drug's reliability in general?","Yes, many cases of PrEP failure are linked to user error, particularly inconsistent adherence. Evidence supporting this includes:

- **iPrEx Study**: Showed that participants who took PrEP consistently had a 92% reduction in HIV risk, while inconsistent users had significantly lower protection.
  
- **Real-World Data**: Reports indicate that individuals who missed doses were more likely to contract HIV, emphasizing the need for regular use.

These findings suggest that while PrEP is highly effective, its reliability hinges on consistent adherence. Continuous monitoring and support can help maximize its protective benefits.","0.0","0.69"
"Are there specific studies that highlight cases of PrEP users who adhered to the regimen but still contracted HIV? What do those cases suggest about the drug's overall effectiveness and potential limitations?","Yes, there are studies that have documented cases of individuals who adhered to PrEP but still contracted HIV. These cases typically suggest:

- **Breakthrough Infections**: Some individuals may have been exposed to a strain of HIV that is resistant to the medications in PrEP, which can lead to infection despite adherence.
  
- **Delayed Effectiveness**: In receptive anal sex, it can take about 7 days for PrEP to reach full effectiveness, meaning recent exposures could result in infection.

- **Monitoring Importance**: Regular follow-ups are crucial for detecting any changes in HIV status and ensuring PrEP remains effective.

These incidents highlight that while PrEP is highly effective, it is not infallible, and understanding its limitations is essential for users. Continuous engagement with healthcare providers is key to optimizing protection.","0.0","0.92"
"Are there any comprehensive studies that specifically investigate the long-term psychological effects of taking PrEP, particularly regarding anxiety or stigma associated with its use? It seems like the focus is often on the physical health aspects, but what about mental health?","Yes, there have been studies investigating the long-term psychological effects of taking PrEP, particularly regarding anxiety and stigma:

1. **PrEP and Mental Health**: Research published in *AIDS Patient Care and STDs* (2016) found that many PrEP users reported improved mental well-being and reduced anxiety related to HIV risk.

2. **HPTN 083 Study**: Included mental health assessments and indicated no significant adverse mental health effects over time. Participants generally felt more secure in their sexual health.

3. **Stigma and Adherence**: Some studies highlight that stigma associated with PrEP can initially cause anxiety, but many users experience a decrease in anxiety as they gain confidence in their HIV prevention strategy.

These findings suggest that while concerns about stigma exist, PrEP can positively impact mental health for many users. For tailored advice, consult your healthcare provider.","0.0","0.62"
"Are you saying that mental well-being improvements are universal among PrEP users? What evidence demonstrates that PrEP doesn’t contribute to increased anxiety or stigma for some individuals, especially those already facing mental health challenges?","While many PrEP users report improvements in mental well-being and reduced anxiety regarding HIV risk, these experiences are not universal. Some individuals, particularly those with pre-existing mental health challenges or stigma concerns, may still experience anxiety related to using PrEP.

### Evidence and Findings:
- **HPTN 083 Study**: This study assessed mental health and found no significant adverse effects on mental well-being among participants, indicating that many felt more secure in their sexual health.
  
- **Stigma Research**: Some studies suggest that stigma can initially increase anxiety for certain users; however, many individuals report that adherence to PrEP ultimately enhances their confidence and reduces anxiety over time.

### Conclusion:
The psychological impact of PrEP can vary widely among individuals. Continuous support and open discussions with healthcare providers can help address any mental health concerns related to PrEP use.","0.0","1.05"
"Are you implying that the studies you mentioned are comprehensive enough to cover all demographics and mental health backgrounds? How can we be sure that the findings are applicable to everyone, especially marginalized groups who might have different experiences with stigma and mental health?","You raise a valid concern. While the studies mentioned provide valuable insights, they may not comprehensively address the diverse experiences of all demographics, particularly marginalized groups. 

- **Limitations**: Many studies often have limited representation, which can affect the generalizability of findings to all populations. Marginalized individuals may face unique stigma and mental health challenges not fully captured in broader research.

- **Ongoing Research**: Continued research is essential to explore the experiences of various demographics, especially those at higher risk of stigma or mental health issues.

- **Personalized Support**: It's crucial for individuals to discuss their specific concerns with healthcare providers who can offer tailored support and resources.

In summary, while existing studies provide a foundation, more inclusive research is needed to ensure findings are applicable to everyone.","0.0","0.52"
"Are you suggesting that the current body of research on PrEP truly accounts for all possible variables that affect its psychological effects? What specific methodologies are in place to ensure that diverse experiences and backgrounds are being truly considered in these studies?","The current body of research on PrEP may not fully account for all variables affecting psychological effects, especially across diverse populations. Here are some considerations regarding methodologies:

- **Diversity in Samples**: Many studies aim to include participants from various backgrounds, but representation can still be limited. Researchers often strive for diversity in age, gender, sexual orientation, and socioeconomic status.

- **Qualitative Research**: Some studies utilize qualitative methods, such as interviews and focus groups, to capture nuanced experiences and perspectives from marginalized groups.

- **Longitudinal Studies**: Ongoing studies track participants over time to observe changes in mental health and adherence, allowing for a better understanding of diverse experiences.

- **Community Engagement**: Collaborating with community organizations can help ensure that research addresses the specific needs and concerns of marginalized populations.

While strides are being made, continued efforts are necessary to ensure comprehensive understanding and representation in PrEP research.","0.0","1.02"
"Are you saying that the qualitative methods used in some studies sufficiently capture the complexities of individuals’ experiences with PrEP, particularly for those from marginalized backgrounds? How do researchers ensure the findings are rigorous and not biased by the researchers' preconceptions or the participants' desire to give socially desirable responses?","Qualitative methods can provide valuable insights into individuals' experiences with PrEP, especially among marginalized groups. However, ensuring rigor and minimizing bias involves several strategies:

- **Triangulation**: Researchers often use multiple data sources or methods to validate findings, enhancing credibility.
  
- **Reflexivity**: Researchers reflect on their biases and preconceptions throughout the study to mitigate their influence on data interpretation.

- **Member Checking**: Participants may be asked to review findings to ensure their experiences are accurately represented.

- **Diverse Research Teams**: Including researchers from various backgrounds can help address blind spots and enhance understanding of different perspectives.

While qualitative methods can capture complexities, ongoing efforts are essential to improve rigor and representation in PrEP research.","0.0","1.15"
"Are you suggesting that the mixed-method approaches used in these studies are enough to bridge the gap in understanding diverse experiences, or do you think they risk oversimplifying complex issues related to PrEP use, especially given societal stigmas? What specific challenges do researchers face in achieving this balance?","Mixed-method approaches can provide a more comprehensive understanding of diverse experiences with PrEP, but they also risk oversimplifying complex issues. Challenges researchers face include:

- **Representation**: Ensuring diverse demographics are included can be difficult, potentially leading to gaps in understanding specific experiences related to stigma.
  
- **Bias**: Researchers must be vigilant about their preconceptions and the influence of social desirability on participants' responses.

- **Contextual Factors**: Societal stigmas and cultural nuances may not be fully captured, affecting the interpretation of findings.

Balancing depth and breadth in research requires continuous refinement of methodologies and engagement with affected communities.","0.0","1.13"
"Are you suggesting that the research on PrEP adequately addresses the power dynamics in participant-researcher interactions? How do researchers mitigate the influence of perceived authority on participants, especially when sensitive topics like stigma and mental health are involved?","Research on PrEP often acknowledges power dynamics in participant-researcher interactions, especially concerning sensitive topics like stigma and mental health. To mitigate the influence of perceived authority, researchers employ several strategies:

- **Building Trust**: Establishing rapport with participants can encourage open communication and reduce anxiety regarding authority figures.
  
- **Confidentiality Assurance**: Emphasizing confidentiality can help participants feel safe sharing their experiences without fear of judgment.

- **Participant Empowerment**: Involving participants in the research process, such as through participatory methods, can help equalize power dynamics.

- **Training on Sensitivity**: Researchers are often trained to approach sensitive subjects with care, ensuring they are aware of their potential impact on participants' willingness to share.

These strategies aim to create a more equitable environment for discussing complex issues surrounding PrEP use.","0.0","1.06"
"Are you implying that these strategies are consistently effective in overcoming power dynamics, or do you think there are inherent limitations that still leave participants feeling vulnerable? What evidence exists to show that participants genuinely feel empowered and safe during these interactions?","While the strategies mentioned aim to mitigate power dynamics, inherent limitations can still leave participants feeling vulnerable. Evidence on participant feelings of empowerment and safety is mixed:

- **Qualitative Feedback**: Some studies report that participants appreciate confidentiality and rapport, which can enhance feelings of safety. However, others indicate lingering concerns about stigma and judgment.

- **Participant Experiences**: Research often includes follow-up surveys or interviews to assess how participants feel during and after interactions, but results can vary based on individual experiences and contexts.

Overall, while strategies are in place to promote empowerment, continuous evaluation and adaptation are necessary to ensure all participants feel genuinely safe and valued.","0.0","0.62"
"Are you suggesting that the current measures to assess participant feelings of safety and empowerment are comprehensive enough, or do you think they might overlook significant aspects of their experiences? What specific methodologies could be improved or introduced to better capture the nuances of participant interactions in research on PrEP?","Current measures to assess participant feelings of safety and empowerment may not fully capture all nuances of their experiences. To improve methodologies, consider the following:

- **Longitudinal Studies**: Incorporating follow-up assessments over time can provide insights into evolving feelings of safety and empowerment.
  
- **Diverse Qualitative Approaches**: Utilizing focus groups alongside individual interviews can facilitate deeper discussions and reveal group dynamics.

- **Participatory Action Research**: Involving participants in the research design can empower them and ensure their perspectives are prioritized.

- **Anonymous Feedback Mechanisms**: Providing options for anonymous feedback post-interaction can encourage more honest reflections on their experiences.

These enhancements can help researchers better understand and address participants' needs in PrEP studies.","0.0","0.51"
"Are you suggesting that the proposed improvements to research methodologies will truly address all the complexities of participant experiences, or do you think they still risk simplifying the multifaceted nature of interactions, especially in vulnerable populations? What evidence supports the effectiveness of these enhanced approaches in capturing the full scope of individual experiences related to PrEP?","While the proposed improvements to research methodologies aim to address complexities in participant experiences, they may still risk oversimplifying interactions, particularly in vulnerable populations. Evidence supporting these enhanced approaches includes:

- **Participatory Action Research**: Studies indicate that involving participants in the research process leads to more comprehensive insights and greater empowerment, as their voices are prioritized.
  
- **Longitudinal Assessments**: Research shows that tracking experiences over time can reveal shifts in perceptions and feelings of safety, providing a fuller picture of individual experiences.

- **Mixed-Methods Approaches**: Combining qualitative and quantitative data has been shown to enhance understanding of participants' perspectives, capturing nuances that single-method studies might miss.

These strategies can improve the depth of understanding but require continuous refinement and community engagement to ensure they truly reflect the complexities of participants' experiences with PrEP.","0.0","0.79"
"Are you suggesting that these mixed-methods approaches genuinely mitigate the risk of oversimplifying participant experiences, or do you believe that the complexities of lived experiences—especially in marginalized groups—might still be inadequately represented? What concrete examples exist from previous studies that illustrate significant nuances being overlooked?","Mixed-methods approaches can enhance understanding of participant experiences, but they may still inadequately represent the complexities of lived experiences, particularly in marginalized groups. For example:

- **Underrepresentation**: Studies often focus on dominant narratives, potentially overlooking unique challenges faced by specific populations, such as LGBTQ+ individuals or people of color.

- **Nuanced Experiences**: Research may miss subtle factors like intersectionality, where multiple identities affect individuals' experiences with stigma or healthcare access.

Concrete examples include studies where participants expressed feelings of invisibility or lack of support that weren’t captured in quantitative data. Continuous refinement of methodologies is crucial to address these gaps. Engaging with diverse communities can help ensure their experiences are fully represented.","0.0","1.05"
"Are you asserting that the existing mixed-methods approaches are truly sufficient to capture the complex experiences of all participants, particularly those from marginalized backgrounds? How do researchers effectively address the risk of reinforcing existing biases in their findings, especially when examining sensitive issues like stigma and mental health?","While mixed-methods approaches aim to capture complex experiences, they may not fully encompass the diversity of perspectives, particularly from marginalized backgrounds. Researchers can address biases by:

- **Diverse Recruitment**: Actively seeking participants from various demographics to ensure representation.
  
- **Reflexivity**: Researchers reflect on their biases and assumptions throughout the study to minimize their impact.
  
- **Community Engagement**: Collaborating with community organizations ensures that the research addresses specific needs and concerns.

- **Inclusive Questioning**: Designing questions that allow participants to express their unique experiences without leading them toward socially desirable responses.

These strategies help mitigate biases and enhance the richness of data collected regarding stigma and mental health in PrEP research.","0.0","0.78"
"Are you suggesting that the efforts to diversify recruitment in research on PrEP are genuinely thorough, or could they still be falling short in representing the full spectrum of marginalized voices? What specific barriers do researchers face in ensuring all demographics are adequately represented in their studies?","While efforts to diversify recruitment in PrEP research are ongoing, they may still fall short in fully representing marginalized voices. Specific barriers include:

- **Access to Participants**: Marginalized groups may face barriers such as transportation, healthcare access, or fear of stigma, making it challenging for researchers to engage them.
  
- **Trust Issues**: Historical mistrust in medical research can deter participation from certain communities.

- **Funding Limitations**: Research funding may prioritize certain demographics, leading to underrepresentation of others.

- **Cultural Sensitivity**: Researchers may lack the training to effectively engage with diverse populations, impacting recruitment.

Addressing these barriers requires sustained effort, community collaboration, and tailored outreach strategies.","0.0","1.13"
"Are you asserting that current outreach strategies are effective enough to overcome these barriers and genuinely engage marginalized communities in PrEP research? What evidence exists to demonstrate that these strategies have actually led to increased participation from underrepresented groups?","Current outreach strategies may not be fully effective in overcoming barriers to engage marginalized communities in PrEP research. Evidence on their success is mixed:

- **Community-Based Approaches**: Some studies show that tailored outreach, including partnership with local organizations, has increased participation from underrepresented groups. For example, the use of peer educators has been effective in reaching marginalized populations.

- **Incentives**: Research indicates that providing incentives for participation can enhance engagement, particularly among groups facing economic barriers.

However, challenges like mistrust and access still persist, indicating that while some strategies have shown promise, ongoing efforts and adjustments are needed to ensure broader representation in research. Continuous evaluation of outreach effectiveness is essential to adapt and improve these strategies.","0.0","0.73"
"Are you suggesting that the success of community-based approaches in increasing participation from marginalized groups is widely replicable, or do you think there are significant contextual factors that might limit their effectiveness in different settings? What specific evidence exists to show whether these strategies consistently achieve their goals across diverse populations?","While community-based approaches have shown promise in increasing participation from marginalized groups, their success can vary significantly based on contextual factors, such as cultural dynamics, local trust levels, and resource availability. Evidence suggests that strategies like partnering with local organizations and employing peer educators can be effective, but outcomes may differ across settings.

For instance, studies have indicated that tailored outreach can lead to enhanced engagement in some communities, yet barriers such as mistrust and socioeconomic factors remain prevalent. Continuous evaluation of these strategies is essential to adapt them effectively to diverse populations and ensure consistent achievement of participation goals.","0.0","0.97"
