"User_Message","Response","Response_Time","Temperature"
"Are you implying that the strategies to evaluate the effectiveness of community-based approaches in PrEP research are robust enough to capture all the nuances of diverse populations, or do you think they might still overlook significant contextual differences? What specific methodologies could be improved to ensure that the findings reflect the true impact of these outreach efforts across various communities?","While community-based approaches have potential, current evaluation strategies may not fully capture the nuances of diverse populations. Methodologies that could be improved include:

- **Culturally Tailored Assessments**: Incorporating culturally relevant metrics can help reflect community-specific needs and outcomes.

- **Longitudinal Studies**: Tracking participation and impact over time allows for a better understanding of sustained engagement and effectiveness.

- **Mixed-Methods Approaches**: Combining quantitative data with qualitative feedback can provide richer insights into participant experiences.

- **Community Involvement**: Engaging community members in the research design process ensures their perspectives are prioritized, enhancing relevance and accuracy.

These improvements can help ensure findings truly reflect the impact of outreach efforts across various communities.","0.0","0.58"
"Are you suggesting that the current methodologies used to evaluate community-based approaches in PrEP research adequately address intersectionality, or do you believe they might oversimplify the experiences of individuals who belong to multiple marginalized identities? What specific examples exist that illustrate how intersectional factors have been overlooked in previous studies?","Current methodologies in evaluating community-based approaches in PrEP research often fall short of fully addressing intersectionality. Many studies primarily focus on single identity factors, potentially oversimplifying the experiences of individuals with multiple marginalized identities. 

### Examples of Overlooked Intersectional Factors:
- **Racial and Gender Dynamics**: Research may not adequately consider how the intersection of race and gender affects access to PrEP, leading to gaps in understanding specific barriers faced by women of color.
- **Economic Status**: Studies often fail to explore how socioeconomic factors intersect with sexual health access, particularly for those in low-income communities.

### Recommendations:
To improve, researchers should adopt methodologies that explicitly incorporate intersectional analysis, ensuring that diverse experiences are thoroughly represented. This could involve qualitative interviews focusing on individuals' multi-faceted identities and their unique challenges in accessing PrEP.","0.0","0.55"
"I'm curious about the validity of the studies you referenced regarding PrEP use among marginalized groups. Are you suggesting that the findings from those studies are not influenced by the researchers' biases, or how can we be sure that the results truly reflect the experiences of participants rather than the expectations of researchers? What safeguards exist to prevent bias in the interpretation of qualitative data within these studies?","It's essential to acknowledge that all research can be subject to bias, including studies on PrEP among marginalized groups. To mitigate these biases and ensure findings reflect participants' experiences, researchers employ several safeguards:

- **Reflexivity**: Researchers are trained to reflect on their biases and preconceptions throughout the study process, which helps minimize their influence on data interpretation.

- **Triangulation**: Using multiple data sources or methods can validate findings and provide a more comprehensive understanding of participant experiences.

- **Peer Review**: Studies often undergo peer review, where other experts evaluate the methodology and findings, promoting accountability.

- **Member Checking**: Participants may review findings to ensure their experiences are accurately represented, adding another layer of validation.

These strategies help enhance the credibility of qualitative research, but ongoing vigilance is necessary to address potential biases.","0.0","1.18"
