"User_Message","Response","Response_Time","Temperature"
"I'm really anxious about this whole situation. Would PrEP actually reduce my risk in my case? How do I know if I even need PrEP?","PrEP can significantly reduce your risk of HIV infection, especially if you engage in behaviors that put you at higher risk. To determine if you need PrEP, consider the following:

- **Risk Factors**: Have you had unprotected sex with partners whose HIV status you don't know? 
- **Partner's Status**: Do you have an HIV-positive partner not on treatment?
- **Multiple Partners**: Are you in multiple sexual relationships?
- **Injection Drug Use**: Do you share needles or injection equipment?

If these apply, PrEP may be a suitable option for you. Consult a healthcare provider for personalized assessment and guidance.","0.0","0.75"
"I appreciate your help. I'm still feeling really uncertain. How hard is it to get PrEP? Can I get it without a prescription?","To obtain PrEP, a prescription from a healthcare provider is required. Here's a straightforward process:

- **Consultation**: Schedule an appointment with a healthcare provider to assess your risk and discuss PrEP.
  
- **Testing**: You'll need to undergo HIV testing and possibly kidney function tests.

- **Prescription**: If deemed appropriate, you will receive a prescription for either oral PrEP (Truvada) or injectable PrEP (CAB-LA).

- **Access**: Once prescribed, you can get PrEP from pharmacies or clinics.

While it does require a prescription, many health insurance plans cover it, and assistance programs are available for those without insurance.","0.0","0.65"
"I'm really worried about how effective PrEP is. Is it 100% effective, or are there cases where it fails? What if I do everything right and still get HIV?","PrEP is highly effective, reducing the risk of HIV by about 99% when taken consistently as prescribed. However, it is not 100% effective. Some scenarios where PrEP may fail include:

- **Inconsistent Dosing**: Missing doses can significantly lower effectiveness.
- **Existing HIV Infection**: Starting PrEP while already HIV-positive can lead to drug resistance.
- **Type of Exposure**: It may take time for PrEP to reach full effectiveness based on the type of sexual activity.

Regular follow-ups and adhering to the regimen are crucial to maximize its protective benefits. If you have concerns, consult your healthcare provider for tailored advice.","0.0","0.54"
"What if I take PrEP and it harms my body? Are the side effects dangerous?","While most individuals tolerate PrEP well, some may experience mild side effects such as headache, nausea, or fatigue. Serious side effects are rare. Regular monitoring by your healthcare provider ensures that any potential issues, such as kidney function changes, are identified early. 

It's essential to discuss any concerns with your provider to weigh the benefits against potential risks. Overall, many find PrEP to be a safe and effective preventive measure against HIV.","0.0","0.65"
"I'm really worried about the stigma around taking PrEP. If I start taking it, will people assume things about me? What if someone finds out?","It's understandable to be concerned about stigma surrounding PrEP. However, it's important to remember that taking PrEP is a proactive health decision aimed at preventing HIV. 

### Key Points:
- **Personal Choice**: Many individuals use PrEP for various reasons, including having HIV-positive partners or engaging in high-risk behaviors.
- **Increased Awareness**: As awareness about PrEP grows, understanding its role in HIV prevention may help diminish stigma over time.
- **Confidentiality**: Your health choices are personal, and you are not obligated to disclose your PrEP use unless you choose to.

Prioritizing your health and well-being is what truly matters. If you have further concerns, consider discussing them with a supportive healthcare provider or community group.","0.0","0.7"
"I'm really anxious about the idea of taking PrEP for a long time. Is it safe to take PrEP for years? What if I want to stop later?","PrEP has been shown to be safe for long-term use. Clinical studies have indicated no significant long-term side effects for individuals taking PrEP for extended periods. 

If you decide to stop taking PrEP, you can do so at any time, but it's essential to discuss it with your healthcare provider. After discontinuing, your protection against HIV will decrease over 7-10 days, so consider using other prevention methods during that time. Regular follow-ups can help monitor your health regardless of your decision.","0.0","0.94"
"What if I feel overwhelmed—who can I talk to for support? I’m just feeling really lost in all of this.","It's completely normal to feel overwhelmed when considering your options for HIV prevention. Here are some supportive resources you can reach out to:

- **Healthcare Providers**: They can provide personalized guidance and answer your questions.
  
- **PrEP Navigators**: Many clinics have navigators who specialize in helping individuals access PrEP and provide support.

- **Community Organizations**: Local health departments or organizations focused on HIV prevention often offer support groups and educational resources.

- **Friends and Family**: Talking to trusted individuals in your life can provide emotional support.

- **Online Communities**: Platforms like forums or social media groups focused on HIV prevention can connect you with others who share similar experiences.

Don't hesitate to reach out—you're not alone in this journey!","0.0","0.88"
"I'm feeling a bit better knowing there are people I can talk to, but I still have some doubts. What could go wrong if I start taking PrEP? Are there any serious risks I should be aware of?","It's great to hear you're feeling better! While PrEP is generally safe, there are some potential risks to consider:

- **Mild Side Effects**: Common side effects include headaches, nausea, and fatigue, usually temporary.
- **Kidney Function**: PrEP can affect kidney health; regular monitoring is essential.
- **Drug Resistance**: If you are already HIV-positive and start PrEP, it may lead to drug resistance.

Serious side effects are rare. Regular follow-ups with your healthcare provider can help manage any risks effectively. Always discuss your concerns with a provider for personalized advice.","0.0","0.83"
"I'm still anxious about how PrEP might affect my life. Are there any specific lifestyle changes I need to make if I start taking it? Like, will I need to change my routines or be more careful in certain situations?","Starting PrEP may involve some lifestyle adjustments, but they are generally manageable:

- **Routine**: Incorporate taking PrEP into your daily routine, such as pairing it with meals or other daily activities to enhance adherence.

- **Regular Appointments**: Schedule follow-up visits every three months for HIV testing and health monitoring.

- **Awareness**: Stay informed about your sexual health and continue practicing safer sex, such as using condoms, especially since PrEP does not protect against other STDs.

- **Communication**: Discuss your PrEP use with partners for transparency and support.

These adjustments can help maximize the effectiveness of PrEP and ensure your health and well-being. If you have further concerns, consider discussing them with your healthcare provider.","0.0","0.69"
"I'm still feeling a bit unsure about everything. What if I want to stop taking PrEP suddenly? Are there any specific consequences I should be aware of if I just decide to quit?","If you decide to stop taking PrEP, here are some important points to consider:

- **Protection Decrease**: Your protection against HIV will diminish within 7-10 days after stopping. It's advisable to use other prevention methods during this time.

- **Consultation**: Always discuss your decision with your healthcare provider. They can provide guidance and help you transition to other prevention strategies if needed.

- **Regular Testing**: Continue regular HIV testing to monitor your status, especially if you are sexually active.

Stopping PrEP should be a thoughtful decision, so consult with your provider for personalized advice.","0.0","0.55"
"I'm still feeling pretty uncertain about all of this. What if I end up having a bad reaction to PrEP? How likely is that, and what should I be prepared for?","It's understandable to feel uncertain. Most individuals tolerate PrEP well, with serious side effects being rare. Common side effects may include:

- **Mild Nausea**
- **Headaches**
- **Fatigue**

These typically resolve within a few weeks. Serious reactions are uncommon, but if you experience significant mood changes, persistent stomach pain, or changes in urine color or amount, contact your healthcare provider immediately. Regular follow-ups will help monitor your health and address any concerns. Always discuss your worries with your provider for personalized guidance.","0.0","0.72"
"I'm really worried about how my decision might be perceived. If I start taking PrEP, will people assume things about me? What if someone finds out I'm on it?","It's understandable to have concerns about stigma regarding PrEP. However, it's important to remember that taking PrEP is a proactive health choice aimed at preventing HIV. 

### Key Points:
- **Personal Choice**: Many individuals use PrEP for various reasons, including having HIV-positive partners or engaging in high-risk behaviors.
- **Increased Awareness**: As awareness about PrEP grows, understanding its role in HIV prevention may help reduce stigma over time.
- **Confidentiality**: Your health choices are personal, and you are not obligated to disclose your PrEP use unless you choose to.

Prioritizing your health and well-being is what truly matters. If you have further concerns, consider discussing them with a supportive healthcare provider or community group.","0.0","1.14"
"I'm still feeling pretty anxious about this whole situation. What if I end up having a bad reaction to PrEP? How likely is that, and what should I be prepared for?","It's understandable to feel anxious. Most individuals tolerate PrEP well, with serious side effects being rare. Common side effects include:

- **Mild Nausea**
- **Headaches**
- **Fatigue**

These typically resolve within a few weeks. Serious reactions are uncommon, but if you experience significant mood changes, persistent stomach pain, or changes in urine color, contact your healthcare provider immediately. Regular follow-ups will help monitor your health. Always discuss any concerns with your provider for personalized guidance.","0.0","1.02"
"I'm still really anxious about starting this. What if I miss a dose of PrEP? Can that make me more vulnerable to HIV, and what should I do in that situation?","Missing a dose of PrEP can reduce its effectiveness, potentially making you more vulnerable to HIV. Here's what to do if you miss a dose:

- **Take it ASAP**: If you remember within 12 hours, take the missed dose right away.
- **Skip if Close**: If it's almost time for your next dose, skip the missed dose and resume your regular schedule.
- **Regular Follow-ups**: Keep up with your healthcare provider for regular check-ins.

If you have concerns about adherence, consider discussing options like injectable PrEP (CAB-LA), which is administered every two months. Your health and safety are the priority!","0.0","1.14"
"I'm still feeling really uncertain about all of this. What if I miss a dose of PrEP? Can that make me more vulnerable to HIV, and what should I do in that situation?","Missing a dose of PrEP can reduce its effectiveness, potentially increasing your vulnerability to HIV. Here's what to do if you miss a dose:

- **Take it ASAP**: If you remember within 12 hours, take the missed dose right away.
- **Skip if Close**: If it’s almost time for your next dose, skip the missed dose and resume your regular schedule.
- **Consult Your Provider**: Keep regular follow-ups with your healthcare provider to discuss adherence strategies.

If you're concerned about missing doses, consider discussing options like injectable PrEP (CAB-LA), which requires fewer appointments. Your health is the priority!","0.0","0.6"
"I’m really feeling overwhelmed by all of this. If I miss a dose of PrEP, can that really make me more vulnerable to HIV? What should I be prepared for if that happens?","Yes, missing a dose of PrEP can reduce its effectiveness, potentially making you more vulnerable to HIV. Here’s what to do if you miss a dose:

- **Take it ASAP**: If you remember within 12 hours, take the missed dose right away.
- **Skip if Close**: If it’s almost time for your next dose, skip the missed one and resume your regular schedule.
- **Consult Your Provider**: Regular follow-ups with your healthcare provider are essential to discuss adherence strategies and any concerns.

If you're worried about missing doses, consider discussing options like injectable PrEP (CAB-LA), which may fit better with your routine. Your health is the priority!","0.0","0.68"
"I'm really anxious about how this whole situation is affecting me. What if I start taking PrEP and it doesn’t work for me? How do I know for sure that it will be effective in my case?","It's understandable to feel anxious about starting PrEP. Here are some key points to consider regarding its effectiveness:

- **High Efficacy**: When taken consistently as prescribed, daily oral PrEP reduces the risk of HIV infection by about 99%. Injectable PrEP (CAB-LA) also offers similar protection.

- **Adherence Matters**: The effectiveness of PrEP largely depends on taking it regularly. Missing doses can reduce its protective benefits.

- **Regular Testing**: You'll undergo routine HIV tests every three months, which will help confirm that PrEP is effectively preventing HIV.

- **Consult Your Provider**: Discuss your concerns with your healthcare provider. They can assess your individual risk factors and provide personalized guidance.

Remember, your health and safety are the priority!","0.0","0.7"
"I'm still feeling pretty uneasy. What if I start taking PrEP and it doesn't fit well with my lifestyle? Are there specific things I need to consider or change in my daily routine to make it work?","It's natural to feel uneasy about starting PrEP. Here are some considerations to help integrate it into your lifestyle:

- **Daily Routine**: Incorporate taking PrEP at the same time each day, possibly with meals or other daily activities to aid consistency.
  
- **Reminders**: Use alarms or medication apps to remind you to take your dose.

- **Regular Appointments**: Schedule follow-up visits every three months for testing and monitoring.

- **Communication**: Discuss your PrEP use with partners for support and transparency.

- **Adaptability**: If daily pills are challenging, consider injectable PrEP (CAB-LA), which is given every two months.

These adjustments can help maximize PrEP's effectiveness and fit it into your life more smoothly. If you have further concerns, consult your healthcare provider for personalized guidance.","0.0","1.14"
"I'm still feeling really anxious about all of this. What if I start taking PrEP and it doesn’t work for me? How do I know for sure that it will be effective in my case?","It's completely understandable to feel anxious. Here are key points regarding PrEP's effectiveness:

- **High Efficacy**: When taken consistently, daily oral PrEP reduces the risk of HIV infection by about 99%, while injectable PrEP (CAB-LA) also offers similar protection.

- **Adherence is Crucial**: The effectiveness of PrEP depends on regular use. Missing doses can decrease its protective benefits.

- **Regular Monitoring**: You will undergo routine HIV tests every three months, allowing for ongoing assessment of PrEP's effectiveness.

- **Consult Your Provider**: Discuss your concerns with your healthcare provider, who can help assess your individual risk factors and provide personalized guidance.

Your health is the priority, and open communication with your provider can help ease your anxiety.","0.0","0.84"
"I really appreciate your reassurance, but it’s hard not to feel pressured. What if I start PrEP and find that my anxiety actually increases instead of decreases? How can I manage those feelings while I’m on it?","It's completely normal to feel anxious about starting PrEP. Here are some strategies to manage those feelings:

- **Open Communication**: Talk to your healthcare provider about your concerns. They can provide support and adjust your plan if needed.

- **Support System**: Connect with friends, family, or support groups who understand your journey. Sharing experiences can help alleviate anxiety.

- **Mindfulness Techniques**: Consider practices like meditation, deep breathing, or yoga to help manage stress.

- **Regular Check-ins**: Schedule frequent follow-ups with your provider to discuss any anxiety or side effects you may experience.

- **Explore Alternatives**: If anxiety persists, discuss other prevention options, such as injectable PrEP (CAB-LA), which might fit better with your lifestyle.

Remember, prioritizing your mental health is just as important as your physical health. You're not alone in this!","0.0","1.11"
"I'm really feeling overwhelmed with all of this. What if I start taking PrEP and my anxiety increases instead of decreases? How can I manage those feelings while I’m on it?","It's completely normal to feel anxious about starting PrEP. Here are some strategies to help manage those feelings:

- **Open Communication**: Discuss your concerns with your healthcare provider. They can provide support and make adjustments if needed.

- **Support System**: Connect with friends, family, or support groups who understand your journey. Sharing experiences can alleviate anxiety.

- **Mindfulness Techniques**: Consider practices like meditation, deep breathing, or yoga to help manage stress.

- **Regular Check-ins**: Schedule frequent follow-ups with your provider to address any anxiety or side effects.

- **Explore Alternatives**: If anxiety persists, discuss other prevention options, like injectable PrEP (CAB-LA), which might suit you better.

Prioritizing your mental health is just as important as your physical health. You're not alone in this!","0.0","1.09"
"I'm really feeling lost in all of this. What if I start taking PrEP and my anxiety gets worse instead of better? How can I manage those feelings while I’m on it?","It's understandable to feel anxious about starting PrEP. Here are some strategies to help manage those feelings:

- **Open Communication**: Talk to your healthcare provider about your concerns. They can offer support and adjust your plan if needed.
  
- **Support System**: Connect with friends, family, or support groups to share experiences and reduce feelings of isolation.
  
- **Mindfulness Techniques**: Consider practices like meditation, deep breathing, or yoga to help manage stress and anxiety.

- **Regular Check-ins**: Schedule follow-up appointments with your provider to discuss any anxiety or side effects you may experience.

- **Explore Alternatives**: If anxiety persists, consider discussing other prevention options, such as injectable PrEP (CAB-LA), which might fit better with your lifestyle.

Prioritizing your mental health is just as important as your physical health, and you're not alone in this journey!","0.0","0.6"
"I'm still feeling really lost in all of this. What if I start taking PrEP and my anxiety gets worse instead of better? How can I manage those feelings while I’m on it?","It's completely normal to feel anxious about starting PrEP. Here are some strategies to help manage those feelings:

- **Open Communication**: Discuss your concerns with your healthcare provider. They can provide support and adjust your plan if needed.
  
- **Support System**: Connect with friends, family, or support groups to share experiences and reduce feelings of isolation.

- **Mindfulness Techniques**: Consider practices like meditation, deep breathing, or yoga to help manage stress and anxiety.

- **Regular Check-ins**: Schedule follow-up appointments with your provider to discuss any anxiety or side effects you may experience.

- **Explore Alternatives**: If anxiety persists, consider discussing other prevention options, such as injectable PrEP (CAB-LA), which might fit better with your lifestyle.

Prioritizing your mental health is just as important as your physical health, and you're not alone in this journey!","0.0","0.88"
"I'm still feeling really lost in all of this. What if I start taking PrEP and it doesn’t work for me? How do I know for sure that it will be effective in my case?","It's understandable to feel lost. Here are key points about PrEP's effectiveness:

- **High Efficacy**: When taken consistently, daily oral PrEP reduces HIV risk by about 99%. Injectable PrEP (CAB-LA) offers similar protection.

- **Adherence Matters**: Consistent use is crucial. Missing doses can reduce effectiveness, so it's important to take it as prescribed.

- **Regular Monitoring**: You'll have routine HIV tests every three months, which will help confirm that PrEP is effectively preventing HIV.

- **Consult Your Provider**: Discuss any concerns with your healthcare provider, who can assess your individual risk factors and provide personalized guidance.

Your health is the priority, and open communication with your provider can help ease your anxiety.","0.0","1.17"
"I'm still feeling really overwhelmed by all of this. What if I start taking PrEP and it doesn’t fit well with my lifestyle? Are there specific things I need to consider or change in my daily routine to make it work?","It's natural to feel overwhelmed. Here are some considerations for integrating PrEP into your lifestyle:

- **Daily Routine**: Take PrEP at the same time each day, possibly with meals or alongside other daily habits to help with consistency.
  
- **Reminders**: Use alarms or medication apps to remind you to take your dose.

- **Regular Appointments**: Plan for follow-up visits every three months for HIV testing and health monitoring.

- **Communication**: Discuss your PrEP use with partners for support.

- **Alternatives**: If daily pills are challenging, consider injectable PrEP (CAB-LA), which requires fewer appointments.

These adjustments can help make PrEP a more manageable part of your life. If you have further concerns, consult your healthcare provider for personalized guidance.","0.0","0.51"
